{
  "task_type": "triage",
  "task_id": "939",
  "started_at": "2026-02-17T09:49:41",
  "finished_at": "2026-02-17T09:51:12",
  "attempts": [
    {
      "agent": "gemini",
      "task": "triage",
      "success": true,
      "result": {
        "decision": "needs_info",
        "reason": "Maintainer requested a triage refresh and verification of relevance on the latest build, as existing SQL capabilities may serve as a sufficient workaround.",
        "priority": "P3-enhancement",
        "estimated_files": [
          "mRemoteNG/Tree/ConnectionTreeModel.cs",
          "mRemoteNG/Connection/ConnectionsService.cs"
        ],
        "approach": "Wait for user feedback. If implemented, would require a new 'DynamicFolder' node type and sync logic to update children from external sources."
      },
      "raw_output": "I will list the contents of the `mRemoteNG/Config` and `mRemoteNG/Connection` directories to understand how connections are currently structured and loaded, which will help in evaluating the feasibility of the \"Dynamic Connection Folder\" feature request.\nI will search for \"Active Directory\" and \"Consul\" in the codebase to see if any similar integration exists, and list the contents of `mRemoteNG/Config/Import` to understand the current import capabilities.\nI will list the contents of `mRemoteNG/Config/DatabaseConnectors` to confirm SQL support and read `mRemoteNG/Connection/ConnectionsService.cs` to understand how connections are loaded, which will help determine if \"Dynamic Folders\" are implemented or if the request requires significant development.\nI will list the contents of `mRemoteNG/Tree` to confirm the existence of `ConnectionTreeModel.cs` before finalizing the JSON response.\n{\n\"decision\": \"needs_info\",\n\"reason\": \"Maintainer requested a triage refresh and verification of relevance on the latest build, as existing SQL capabilities may serve as a sufficient workaround.\",\n\"priority\": \"P3-enhancement\",\n\"estimated_files\": [\"mRemoteNG/Tree/ConnectionTreeModel.cs\", \"mRemoteNG/Connection/ConnectionsService.cs\"],\n\"approach\": \"Wait for user feedback. If implemented, would require a new 'DynamicFolder' node type and sync logic to update children from external sources.\"\n}\n",
      "errors": null,
      "files_modified": [],
      "build_result": null,
      "test_result": null,
      "timed_out": false,
      "diff_summary": null,
      "timestamp": "2026-02-17T09:51:12"
    }
  ],
  "timeout_count": 0,
  "all_timed_out": false,
  "final_success": true
}
