{
  "task_type": "triage",
  "task_id": "1174",
  "started_at": "2026-02-19T15:46:14",
  "finished_at": "2026-02-19T15:47:21",
  "attempts": [
    {
      "agent": "codex",
      "task": "triage",
      "success": false,
      "result": null,
      "raw_output": "",
      "errors": "Agent returned None",
      "files_modified": [],
      "build_result": null,
      "test_result": null,
      "timed_out": false,
      "diff_summary": null,
      "timestamp": "2026-02-19T15:46:14"
    },
    {
      "agent": "gemini",
      "task": "triage",
      "success": true,
      "result": {
        "decision": "implement",
        "reason": "The issue describes a UI rendering or layout problem ('bad screen') upon maximizing the main window, likely related to window state handling or DPI scaling.",
        "priority": "P2-bug",
        "estimated_files": [
          "mRemoteNG/UI/Forms/frmMain.cs",
          "mRemoteNG/UI/DPI_Per_Monitor.cs"
        ],
        "approach": "Investigate FrmMain's resize and maximize event handlers, specifically checking for layout recalculation errors or conflicts with DPI scaling logic."
      },
      "raw_output": "I will search for any existing context or mentions of issue #1174 in the current directory to inform the triage decision.\nI will list the contents of `mRemoteNG/UI` and `mRemoteNG/UI/Forms` to confirm the location of the main form and any relevant controls before finalizing the triage JSON.\nI will search for \"Maximize\" or \"WindowState\" in `mRemoteNG/UI/Forms/frmMain.cs` to see if there is custom window state handling that might be related to the reported issue.\nI will verify if there is any information about issue #1174 in the `.project-roadmap/issues-db` directory before finalizing the triage JSON.\n```json\n{\n  \"decision\": \"implement\",\n  \"reason\": \"The issue describes a UI rendering or layout problem ('bad screen') upon maximizing the main window, likely related to window state handling or DPI scaling.\",\n  \"priority\": \"P2-bug\",\n  \"estimated_files\": [\n    \"mRemoteNG/UI/Forms/frmMain.cs\",\n    \"mRemoteNG/UI/DPI_Per_Monitor.cs\"\n  ],\n  \"approach\": \"Investigate FrmMain's resize and maximize event handlers, specifically checking for layout recalculation errors or conflicts with DPI scaling logic.\"\n}\n```\n",
      "errors": null,
      "files_modified": [],
      "build_result": null,
      "test_result": null,
      "timed_out": false,
      "diff_summary": null,
      "timestamp": "2026-02-19T15:47:21"
    }
  ],
  "timeout_count": 0,
  "all_timed_out": false,
  "final_success": true
}
