{
  "task_type": "triage",
  "task_id": "2038",
  "started_at": "2026-02-22T07:19:26",
  "finished_at": "2026-02-22T07:23:13",
  "attempts": [
    {
      "agent": "codex",
      "task": "triage",
      "success": false,
      "result": null,
      "raw_output": "",
      "errors": "Agent returned None",
      "files_modified": [],
      "build_result": null,
      "test_result": null,
      "timed_out": false,
      "diff_summary": null,
      "timestamp": "2026-02-22T07:19:27"
    },
    {
      "agent": "gemini",
      "task": "triage",
      "success": false,
      "result": null,
      "raw_output": "This confirms the hypothesis: the `-batch` argument, added when a password is present in the `ConnectionInfo` for the SSH tunnel, is preventing PuTTY from prompting to save host fingerprints.\n\nHere's the plan to address the issue:\n\n1.  **Identify the SSH Tunnel Connection**: In `ConnectionInitiator.cs`, before launching the PuTTY process for the SSH tunnel, determine if the `currentTunnelInfo` represents the tunnel connection.\n2.  **Modify PuTTY Arguments**: If it's an SSH tunnel and the host key is unknown, ensure that the PuTTY arguments allow for host key acceptance and saving, even if a password is provided. This could involve removing the `-batch` argument or adding a specific argument to accept and save the host key.\n\nConsidering security best practices and user experience:\n\n*   **Option 1 (Preferred)**: For the SSH tunnel connection, check if the host key for the tunnel endpoint is already known. If not, temporarily remove the `-batch` argument (if present) to allow PuTTY to prompt the user to accept and save the host key. After the key is accepted (or the connection fails), add `-batch` back for subsequent connection attempts to avoid unnecessary prompts. This requires a way to check if the host key is known.\n*   **Option 2 (Simpler, less secure)**: Always add a PuTTY argument (e.g., `-hostkey *` or a similar PuTTY option) to automatically accept and save the host key for SSH tunnel connections. This is less secure as it bypasses verification.\n*   **Option 3 (More complex, more robust)**: Implement a pre-connection host key check within `mRemoteNG` itself. If the host key is unknown, present a custom prompt to the user to accept it, then programmatically add it to PuTTY's known hosts before launching PuTTY. This would require more significant changes and understanding of PuTTY's internal host key storage.\n\nGiven the goal of \"fingerprints aren't saved\" and the context of a \"triage\" task aiming for a \"brief fix\", Option 1 seems most appropriate as it addresses",
      "errors": "Could not extract valid JSON",
      "files_modified": [],
      "build_result": null,
      "test_result": null,
      "timed_out": false,
      "diff_summary": null,
      "timestamp": "2026-02-22T07:20:37"
    },
    {
      "agent": "claude",
      "task": "triage",
      "success": true,
      "result": {
        "decision": "implement",
        "reason": "PuTTY's -batch flag (added at PuttyBase.cs:688 when password is set) suppresses the host key acceptance prompt, preventing fingerprint saving for SSH tunnel connections.",
        "priority": "P2-bug",
        "estimated_files": [
          "mRemoteNG/Connection/Protocol/PuttyBase.cs",
          "mRemoteNG/Connection/ConnectionInitiator.cs"
        ],
        "approach": "In PuttyBase.cs, when IsSshTunnelSession() is true and the connection has a password, omit -batch or add -hostkey to allow PuTTY to prompt for and save the host fingerprint on first connect."
      },
      "raw_output": "Based on the code analysis, the root cause is clear: `PuttyBase.cs:688` adds `-batch` whenever a password is present, which suppresses PuTTY's interactive host key acceptance prompt â€” fingerprints can never be saved for password-authenticated SSH tunnel connections.\n\n```json\n{\"decision\":\"implement\",\"reason\":\"PuTTY's -batch flag (added at PuttyBase.cs:688 when password is set) suppresses the host key acceptance prompt, preventing fingerprint saving for SSH tunnel connections.\",\"priority\":\"P2-bug\",\"estimated_files\":[\"mRemoteNG/Connection/Protocol/PuttyBase.cs\",\"mRemoteNG/Connection/ConnectionInitiator.cs\"],\"approach\":\"In PuttyBase.cs, when IsSshTunnelSession() is true and the connection has a password, omit -batch or add -hostkey to allow PuTTY to prompt for and save the host fingerprint on first connect.\"}\n```",
      "errors": null,
      "files_modified": [],
      "build_result": null,
      "test_result": null,
      "timed_out": false,
      "diff_summary": null,
      "timestamp": "2026-02-22T07:23:13"
    }
  ],
  "timeout_count": 0,
  "all_timed_out": false,
  "final_success": true
}
